{
  "$schema": "https://json-schema.org/draft/2020-12/schema",
  "title": "Analyst Tools lesson metadata",
  "type": "object",
  "required": [
    "title",
    "type",
    "tracks",
    "prerequisites",
    "time_minutes",
    "outcome",
    "artifact"
  ],
  "properties": {
    "title": {"type": "string", "minLength": 1},
    "type": {"enum": ["build", "learn", "case"]},
    "tracks": {"type": "array", "items": {"type": "string"}, "minItems": 1},
    "prerequisites": {"type": "array", "items": {"type": "string"}},
    "time_minutes": {"type": "integer", "minimum": 1},
    "outcome": {"type": "string", "minLength": 1},
    "artifact": {
      "type": "object",
      "required": ["name", "type", "path"],
      "properties": {
        "name": {"type": "string", "minLength": 1},
        "type": {"type": "string", "minLength": 1},
        "path": {"type": "string", "pattern": "^outputs/"}
      },
      "additionalProperties": false
    },
    "practice": {
      "oneOf": [
        {
          "type": "object",
          "required": ["mode"],
          "properties": {
            "mode": {"const": "executable"}
          },
          "additionalProperties": false
        },
        {
          "type": "object",
          "required": ["mode", "path", "verification"],
          "properties": {
            "mode": {"const": "guided-artifact"},
            "path": {"type": "string", "pattern": "^outputs/"},
            "verification": {"type": "string", "pattern": "^outputs/"}
          },
          "additionalProperties": false
        }
      ]
    }
  },
  "additionalProperties": false
}
