{
  "title": "Доверительные интервалы",
  "type": "build",
  "tracks": ["product", "ml"],
  "prerequisites": ["09-applied-statistics/04-bias-and-variance"],
  "time_minutes": 90,
  "outcome": "Строит confidence intervals для средних и долей через formula-based standard errors, проверяет confidence level, coverage simulation, малые выборки, skew/outliers и явно запрещает интервал при нарушенных assumptions.",
  "artifact": {
    "name": "confidence-interval-calculator",
    "type": "cli",
    "path": "outputs/confidence_interval_calculator.py"
  }
}
