{
  "title": "Диагностика регрессии",
  "type": "build",
  "tracks": ["product", "ml"],
  "prerequisites": ["09-applied-statistics/08-linear-regression"],
  "time_minutes": 75,
  "outcome": "Проверяет residual patterns, heteroscedasticity, leverage, influence, multicollinearity, non-linearity и specification risks, превращая diagnostics в machine-readable flags и ограничения отчета.",
  "artifact": {
    "name": "regression-diagnostics-checker",
    "type": "cli",
    "path": "outputs/regression_diagnostics_checker.py"
  }
}
