{
  "title": "Snapshots и история изменений",
  "type": "build",
  "tracks": [
    "data"
  ],
  "prerequisites": [
    "11-analytics-engineering/07-incremental-models"
  ],
  "time_minutes": 75,
  "outcome": "Использует dbt snapshots для SCD type 2 истории mutable source tables и проверяет unique key, updated_at/check strategy, validity windows и исключение шумных колонок.",
  "artifact": {
    "name": "dbt-snapshot-history-auditor",
    "type": "tool",
    "path": "outputs/snapshot_history_auditor.py"
  }
}
