{
  "title": "Jinja и macros без злоупотребления",
  "type": "learn",
  "tracks": [
    "data"
  ],
  "prerequisites": [
    "11-analytics-engineering/05-data-tests"
  ],
  "time_minutes": 75,
  "outcome": "Выносит повторяемые SQL-правила в читаемые Jinja macros, проверяет compiled SQL, документирует аргументы и не прячет бизнес-логику за избыточной абстракцией.",
  "artifact": {
    "name": "dbt-macro-review-auditor",
    "type": "tool",
    "path": "outputs/macro_review_auditor.py"
  }
}
