{
  "title": "Множественные проверки",
  "type": "case",
  "tracks": ["product"],
  "prerequisites": ["10-experiments/07-cuped"],
  "time_minutes": 75,
  "outcome": "Объявляет families of hypotheses для primary, guardrail, secondary и exploratory metrics, применяет gatekeeping, Holm/Bonferroni или FDR policy и блокирует cherry-picking по сегментам.",
  "artifact": {
    "name": "multiple-testing-policy-checker",
    "type": "cli",
    "path": "outputs/multiple_testing_policy_checker.py"
  }
}
