{
  "title": "CPU и memory profiling",
  "type": "build",
  "tracks": ["data", "ml"],
  "prerequisites": ["12-performance/01-benchmarking"],
  "time_minutes": 75,
  "outcome": "Профилирует один аналитический pipeline по wall time, CPU и памяти, отделяет Python overhead, native allocations, IO и algorithmic hot spots и выпускает actionable profile report.",
  "artifact": {
    "name": "profiling-report",
    "type": "cli",
    "path": "outputs/profiling_report.py"
  }
}
