{
  "title": "Arrow memory model",
  "type": "learn",
  "tracks": ["data", "ml"],
  "prerequisites": ["12-performance/04-parquet-pushdown"],
  "time_minutes": 75,
  "outcome": "Разбирает Arrow buffers, null bitmaps, offsets, chunks и dictionary encoding, инспектирует PyArrow Table/Array и отличает zero-copy обмен от скрытого копирования.",
  "artifact": {
    "name": "arrow-memory-inspector",
    "type": "cli",
    "path": "outputs/arrow_memory_inspector.py"
  }
}
