{
  "title": "Regression adjustment и g-formula",
  "type": "build",
  "tracks": ["decision", "product"],
  "prerequisites": ["13-causal-analysis/04-colliders"],
  "time_minutes": 90,
  "outcome": "Оценивает standardized potential outcomes и ATE/ATT через outcome regression, сверяет ручную g-computation со statsmodels и диагностирует misspecification, extrapolation и неверный adjustment set.",
  "artifact": {
    "name": "g-computation-estimator",
    "type": "cli",
    "path": "outputs/g_computation_estimator.py"
  }
}
