{
  "title": "Постановка ML-задачи",
  "type": "case",
  "tracks": ["ml"],
  "prerequisites": ["09-applied-statistics/10-robust-methods"],
  "time_minutes": 75,
  "outcome": "Формулирует supervised ML-задачу через business decision, prediction unit, target horizon, prediction time, positive/negative class, allowed feature sources и no-causal-claim boundary.",
  "artifact": {
    "name": "ml-problem-spec-validator",
    "type": "cli",
    "path": "outputs/ml_problem_spec_validator.py"
  }
}
