{
  "title": "Даты, интервалы и часовые пояса",
  "type": "case",
  "tracks": [
    "core"
  ],
  "prerequisites": [
    "03-pandas/07-reshape"
  ],
  "time_minutes": 105,
  "outcome": "Строго переводит timestamps с явными offsets в UTC, вычисляет Timedelta между согласованными моментами и выводит локальный календарный день в заданной бизнес-зоне.",
  "artifact": {
    "name": "pandas-time-normalizer",
    "type": "function",
    "path": "outputs/time_normalizer.py"
  }
}
