{
  "title": "FastAPI как факультативный интерфейс",
  "type": "build",
  "tracks": ["delivery"],
  "prerequisites": ["17-delivery/09-scheduled-runs"],
  "time_minutes": 75,
  "outcome": "Добавляет optional read-only API к поставленному результату, фиксируя Pydantic request/response schemas, OpenAPI contract и CLI fallback.",
  "artifact": {
    "name": "fastapi-delivery-endpoint",
    "type": "app",
    "path": "outputs/fastapi_delivery_endpoint.py"
  }
}
