{
  "title": "Документация и lineage",
  "type": "learn",
  "tracks": [
    "data"
  ],
  "prerequisites": [
    "11-analytics-engineering/08-snapshots"
  ],
  "time_minutes": 75,
  "outcome": "Публикует описания sources, models, columns, tests и exposures, генерирует dbt docs artifacts и связывает downstream claims с lineage и owners.",
  "artifact": {
    "name": "dbt-documentation-lineage-auditor",
    "type": "tool",
    "path": "outputs/documentation_lineage_auditor.py"
  }
}
