{
  "title": "Polars expressions",
  "type": "build",
  "tracks": ["data", "ml"],
  "prerequisites": ["12-performance/06-duckdb-out-of-core"],
  "time_minutes": 90,
  "outcome": "Переносит pipeline из pandas в Polars expressions, использует select/with_columns/filter/group_by contexts, избегает row-wise Python UDF и проверяет эквивалентность результата.",
  "artifact": {
    "name": "polars-expression-pipeline",
    "type": "cli",
    "path": "outputs/polars_expression_pipeline.py"
  }
}
