{
  "title": "SQLFluff и единый стиль",
  "type": "build",
  "tracks": [
    "data"
  ],
  "prerequisites": [
    "11-analytics-engineering/09-documentation-and-lineage"
  ],
  "time_minutes": 60,
  "outcome": "Настраивает SQLFluff для DuckDB/dbt SQL, выбирает templater под CI или быстрый feedback, исключает generated artifacts и отличает style violations от semantic test failures.",
  "artifact": {
    "name": "dbt-sqlfluff-quality-gate",
    "type": "tool",
    "path": "outputs/sqlfluff_quality_gate.py"
  }
}
