{
  "title": "Excel как источник: листы, диапазоны и формулы",
  "type": "case",
  "tracks": ["core"],
  "prerequisites": ["05-sources-and-formats/01-csv"],
  "time_minutes": 60,
  "outcome": "Выбирает лист и диапазон, распознает служебное оформление и преобразует рабочую книгу в явную табличную схему.",
  "artifact": {
    "name": "excel-range-audit",
    "type": "cli",
    "path": "outputs/excel_audit.py"
  }
}
