{
  "title": "Проверки SQL-витрин",
  "type": "case",
  "tracks": ["core"],
  "prerequisites": ["07-reliable-analytics/06-pydantic"],
  "time_minutes": 90,
  "outcome": "Проверяет grain, ключи, связи, допустимые значения и reconciliation SQL-витрины отдельными запросами до публикации результата.",
  "artifact": {
    "name": "duckdb-quality-checks",
    "type": "test-suite",
    "path": "outputs/sql_quality_checks.py"
  }
}
