{
  "title": "A/A-тест и Sample Ratio Mismatch",
  "type": "build",
  "tracks": ["product"],
  "prerequisites": ["10-experiments/02-randomization-unit"],
  "time_minutes": 90,
  "outcome": "Проводит A/A-test, SRM check и randomization validation: сверяет expected allocation, variant counts, covariate balance, telemetry loss и metric null distribution до анализа A/B.",
  "artifact": {
    "name": "randomization-health-diagnostic",
    "type": "cli",
    "path": "outputs/randomization_health.py"
  }
}
