{
  "title": "Структура dbt-проекта",
  "type": "build",
  "tracks": ["data"],
  "prerequisites": ["11-analytics-engineering/01-data-layers"],
  "time_minutes": 75,
  "outcome": "Собирает минимальный dbt-проект с `dbt_project.yml`, profile contract, каталогами models/tests/macros/snapshots и воспроизводимыми командами parse, compile и debug.",
  "artifact": {
    "name": "dbt-project-auditor",
    "type": "tool",
    "path": "outputs/dbt_project_auditor.py"
  }
}
