{
  "title": "От ноутбука к модулям и скриптам",
  "type": "build",
  "tracks": [
    "core"
  ],
  "prerequisites": [
    "01-reproducible-project/05-notebook-reproducibility"
  ],
  "time_minutes": 75,
  "outcome": "Выносит переиспользуемый расчет из ноутбука в функцию и CLI-скрипт.",
  "artifact": {
    "name": "order-metrics-cli",
    "type": "cli",
    "path": "outputs/order_metrics_project/src/order_metrics/cli.py"
  }
}
