{
  "title": "Приложение на Streamlit",
  "type": "build",
  "tracks": ["delivery"],
  "prerequisites": ["17-delivery/05-interactive-plotly"],
  "time_minutes": 90,
  "outcome": "Собирает Streamlit-приложение поверх проверенных артефактов: фильтры, decision views, warnings, download actions и app contract без скрытого ad-hoc пересчета.",
  "artifact": {
    "name": "streamlit-stakeholder-app",
    "type": "cli",
    "path": "outputs/streamlit_stakeholder_app.py"
  }
}
