{
  "title": "Численная точность и сравнение результатов",
  "type": "case",
  "tracks": [
    "core"
  ],
  "prerequisites": [
    "02-numpy/09-vectorization"
  ],
  "time_minutes": 60,
  "outcome": "Формулирует численный контракт результата: выбирает точное или приближенное сравнение, обосновывает rtol и atol из единиц и масштаба, контролирует shape, dtype, диапазон и конечность и диагностирует переполнение, underflow и ошибку накопления.",
  "artifact": {
    "name": "numpy-numerical-quality-gate",
    "type": "function",
    "path": "outputs/numerical_checks.py"
  }
}
