{
  "title": "Запуски по расписанию и freshness report",
  "type": "case",
  "tracks": ["delivery"],
  "prerequisites": ["17-delivery/08-cli"],
  "time_minutes": 75,
  "outcome": "Проектирует scheduled refresh: cron metadata, timezone/UTC assumptions, last-success marker, run history, freshness report и failure visibility.",
  "artifact": {
    "name": "scheduled-delivery-workflow",
    "type": "workflow",
    "path": "outputs/scheduled_delivery_workflow.py"
  }
}
