{
  "title": "JSON и вложенные структуры",
  "type": "build",
  "tracks": ["core"],
  "prerequisites": ["05-sources-and-formats/02-excel"],
  "time_minutes": 75,
  "outcome": "Нормализует вложенные объекты и массивы в объявленный grain и обнаруживает изменение схемы без потери сырого JSON.",
  "artifact": {
    "name": "json-grain-normalizer",
    "type": "cli",
    "path": "outputs/json_normalizer.py"
  }
}
