{
  "title": "Слои и контракты аналитических данных",
  "type": "learn",
  "tracks": ["data"],
  "prerequisites": ["07-reliable-analytics/10-quality-gates"],
  "time_minutes": 75,
  "outcome": "Проектирует raw, staging, intermediate и mart слои: фиксирует grain, ключи, владельца, freshness, допустимые изменения схемы и правила публикации аналитической витрины.",
  "artifact": {
    "name": "layer-contract-auditor",
    "type": "data-contract",
    "path": "outputs/layer_contract_auditor.py"
  }
}
